<!ELEMENT biblioteca (libro+)>
<!ELEMENT libro (titulo, autor, fechaPublicacion)>
<!ELEMENT titulo (#PCDATA)>
<!ELEMENT autor (nombre, fechaNacimiento?)>
<!ELEMENT nombre (#PCDATA)>
<!ELEMENT fechaNacimiento (#PCDATA)>
<!ELEMENT fechaPublicacion EMPTY>
<!ATTLIST fechaPublicacion aÃ±o CDATA #REQUIRED>
