<?xml version="1.0" encoding="UTF-8"?>
<?xml-stylesheet type="text/xsl" href="ejercicio1.xsl"?>
<!DOCTYPE biblioteca SYSTEM "ejercicio1.dtd">
<biblioteca>
    <libro>
        <titulo>La vida está en otra parte</titulo>
        <autor>
            <nombre>Milan Kundera</nombre>
        </autor>
        <fechaPublicacion año="1973"/>
    </libro>
    <libro>
        <titulo>Pantaleón y las visitadoras</titulo>
        <autor>
            <nombre>Mario Vargas Llosa</nombre>
            <fechaNacimiento>26/03/1936</fechaNacimiento>
        </autor>
        <fechaPublicacion año="1973"/>
    </libro>
    <libro>
        <titulo>Conversación en la catedral</titulo>
        <autor>
            <nombre>Mario Vargas Llosa</nombre>
            <fechaNacimiento>26/03/1936</fechaNacimiento>
        </autor>
        <fechaPublicacion año="1969"/>
    </libro>
</biblioteca>
